<?xml version="1.0" encoding="UTF-8"?>
<!--Sample XML file generated by XMLSpy v2008 rel. 2 (http://www.altova.com)-->
<pokemons xsi:noNamespaceSchemaLocation="pokemon.xsd" xmlns:xsi="http://www.w3.org/2001/XMLSchema-instance">
	<pokemon nombre="String" codigo="^00$">
		<altura>0.0</altura>
		<categoria>String</categoria>
		<habilidades>
			<habilidad>String</habilidad>
			<habilidad>String</habilidad>
			<habilidad>String</habilidad>
		</habilidades>
		<debilidades>
			<debilidad>String</debilidad>
			<debilidad>String</debilidad>
			<debilidad>String</debilidad>
		</debilidades>
		<puntosBase defensa="1" velocidad="1" ps="1"/>
		<imagen>String</imagen>
		<sexo>
			<masculino>text</masculino>
			<femenino>text</femenino>
		</sexo>
		<tipos>
			<tipo>Roca</tipo>
			<tipo>Roca</tipo>
		</tipos>
	</pokemon>
	<pokemon nombre="String" codigo="^00$">
		<altura>0.0</altura>
		<categoria>String</categoria>
		<habilidades>
			<habilidad>String</habilidad>
			<habilidad>String</habilidad>
			<habilidad>String</habilidad>
		</habilidades>
		<debilidades>
			<debilidad>String</debilidad>
			<debilidad>String</debilidad>
			<debilidad>String</debilidad>
		</debilidades>
		<puntosBase defensa="1" velocidad="1" ps="1"/>
		<imagen>String</imagen>
		<sexo>
			<masculino>text</masculino>
			<femenino>text</femenino>
		</sexo>
		<tipos>
			<tipo>Roca</tipo>
			<tipo>Roca</tipo>
		</tipos>
	</pokemon>
	<pokemon nombre="String" codigo="^00$">
		<altura>0.0</altura>
		<categoria>String</categoria>
		<habilidades>
			<habilidad>String</habilidad>
			<habilidad>String</habilidad>
			<habilidad>String</habilidad>
		</habilidades>
		<debilidades>
			<debilidad>String</debilidad>
			<debilidad>String</debilidad>
			<debilidad>String</debilidad>
		</debilidades>
		<puntosBase defensa="1" velocidad="1" ps="1"/>
		<imagen>String</imagen>
		<sexo>
			<masculino>text</masculino>
			<femenino>text</femenino>
		</sexo>
		<tipos>
			<tipo>Roca</tipo>
			<tipo>Roca</tipo>
		</tipos>
	</pokemon>
</pokemons>
