<?xml version="1.0" encoding="UTF-8"?>
<pokemons xsi:noNamespaceSchemaLocation="pokemon.xsd" xmlns:xsi="http://www.w3.org/2001/XMLSchema-instance">
	<pokemon nombre="Onix" codigo="0019">
		<altura>8.8</altura>
		<categoria>Serpiente Roca</categoria>
		<habilidades>
			<habilidad>Cabeza Roca</habilidad>
			<habilidad>Robustez</habilidad>
		</habilidades>
		<debilidades>
			<debilidad>Agua</debilidad>
			<debilidad>Planta</debilidad>
		</debilidades>
		<puntosBase ps="3" ataque="3" defensa="14"  velocidad="1"/>
		
		<imagen>https://assets.pokemon.com/assets/cms2/img/pokedex/full/095.png</imagen>
		<sexo>
				<masculino/>
				<femenino/>
		</sexo>
		<tipos>
				<tipo>Roca</tipo>
				<tipo>Tierra</tipo>
		</tipos>
	</pokemon>
</pokemons>